{
  "schema": "invar-target-v1",
  "name": "metal-apple7",
  "source": "Metal Feature Set Tables (Apple GPU families 7-9); Metal Shading Language Specification 3.1, section 6.7 SIMD-group matrix functions",
  "device": {"backend": "metal", "apple_family": 7},
  "gpu": {
    "subgroup_width": 32,
    "max_threads_per_group": 1024,
    "shared_bytes_per_group": 32768,
    "shared_bytes_per_group_optin": 32768,
    "registers_per_thread": null,
    "memory_levels": [
      {"level": "global", "alignment_bytes": 4},
      {"level": "shared", "alignment_bytes": 16},
      {"level": "registers", "alignment_bytes": 4}
    ],
    "copy_atoms": [
      {"name": "ld-global-4", "kind": "plain", "from": "global", "to": "registers", "bytes": 4, "alignment_bytes": 4},
      {"name": "ld-global-8", "kind": "plain", "from": "global", "to": "registers", "bytes": 8, "alignment_bytes": 8},
      {"name": "ld-global-16", "kind": "plain", "from": "global", "to": "registers", "bytes": 16, "alignment_bytes": 16},
      {"name": "st-shared-4", "kind": "plain", "from": "registers", "to": "shared", "bytes": 4, "alignment_bytes": 4},
      {"name": "ld-shared-4", "kind": "plain", "from": "shared", "to": "registers", "bytes": 4, "alignment_bytes": 4},
      {"name": "st-global-4", "kind": "plain", "from": "registers", "to": "global", "bytes": 4, "alignment_bytes": 4}
    ],
    "mma_atoms": [
      {"name": "simdgroup-float8x8", "instruction": "simdgroup_multiply_accumulate(simdgroup_float8x8)", "m": 8, "n": 8, "k": 8, "threads": 32, "a_type": "f32", "b_type": "f32", "acc_type": "f32", "contract": "tc-f16-f32-v1", "reference": "tc::reference::reference"}
    ]
  }
}
